{
  "match_id": "epl-2026-08-15-ars-liv",
  "league": {
    "id": "epl",
    "name": "Premier League",
    "country": "England"
  },
  "kickoff_utc": "2026-08-15T19:00:00Z",
  "home_team": {
    "id": "ars",
    "name": "Arsenal"
  },
  "away_team": {
    "id": "liv",
    "name": "Liverpool"
  },
  "odds": {
    "total_line": 3.5,
    "over_price": 1.85,
    "under_price": 1.98,
    "home_price": 2.3,
    "draw_price": 3.5,
    "away_price": 2.95,
    "captured_at": "2026-08-14T09:00:00Z"
  },
  "form": {
    "home": {
      "matches": 10,
      "goals_for_avg": 2.3,
      "goals_against_avg": 1.1
    },
    "away": {
      "matches": 10,
      "goals_for_avg": 2.1,
      "goals_against_avg": 1.3
    }
  },
  "table": {
    "home_position": 3,
    "away_position": 2,
    "total_teams": 20,
    "matchweek": 2
  }
}
