{
  "match_id": "epl-2026-08-15-bha-eve",
  "league": {
    "id": "epl",
    "name": "Premier League",
    "country": "England"
  },
  "kickoff_utc": "2026-08-15T14:00:00Z",
  "home_team": {
    "id": "bha",
    "name": "Brighton & Hove Albion"
  },
  "away_team": {
    "id": "eve",
    "name": "Everton"
  },
  "odds": {
    "total_line": 2.75,
    "over_price": 1.91,
    "under_price": 1.95,
    "home_price": 2.1,
    "draw_price": 3.6,
    "away_price": 3.4,
    "captured_at": "2026-08-14T09:00:00Z"
  },
  "form": {
    "home": {
      "matches": 10,
      "goals_for_avg": 1.7,
      "goals_against_avg": 1.4
    },
    "away": {
      "matches": 10,
      "goals_for_avg": 1.1,
      "goals_against_avg": 1.5
    }
  },
  "table": {
    "home_position": 8,
    "away_position": 14,
    "total_teams": 20,
    "matchweek": 2
  }
}
