{
  "match_id": "epl-2026-08-16-bur-shu",
  "league": {
    "id": "epl",
    "name": "Premier League",
    "country": "England"
  },
  "kickoff_utc": "2026-08-16T14:00:00Z",
  "home_team": {
    "id": "bur",
    "name": "Burnley"
  },
  "away_team": {
    "id": "shu",
    "name": "Sheffield United"
  },
  "odds": {
    "total_line": 2.0,
    "over_price": 2.05,
    "under_price": 1.8,
    "home_price": 1.55,
    "draw_price": 4.0,
    "away_price": 6.5,
    "captured_at": "2026-08-14T09:00:00Z"
  },
  "form": {
    "home": {
      "matches": 10,
      "goals_for_avg": 0.9,
      "goals_against_avg": 1.6
    },
    "away": {
      "matches": 10,
      "goals_for_avg": 0.8,
      "goals_against_avg": 2.0
    }
  },
  "table": {
    "home_position": 17,
    "away_position": 20,
    "total_teams": 20,
    "matchweek": 2
  }
}
